{
  "version": "1.0.0",
  "framework": "Chương trình GDPT 2018 (Thông tư 32/2018/TT-BGDĐT)",
  "total_exercises": 25,
  "exercises": [
    {
      "id": "G1_MATH_01",
      "grade": 1,
      "subject": "Toán",
      "category": "Toán lời văn",
      "topic": "Phép cộng trong phạm vi 10 (Dạng toán thêm vào)",
      "difficulty": "Cơ bản (Nhận biết/Thông hiểu)",
      "estimated_duration_min": 5,
      "original_text": "Trên cành cây có 5 con chim đang đậu. Lát sau có thêm 3 con chim nữa bay đến đậu cùng. Hỏi trên cành cây lúc này có tất cả bao nhiêu con chim?",
      "options": null,
      "distractor_analysis": null,
      "ground_truth_steps": [
        {
          "step_number": 1,
          "instruction": "Đọc đề bài và tìm hai số: số chim ban đầu và số chim bay đến thêm.",
          "mathematical_or_logical_goal": "Nhận diện dữ kiện đã cho",
          "intermediate_output": "Ban đầu: 5 con; thêm vào: 3 con"
        },
        {
          "step_number": 2,
          "instruction": "Chọn phép tính để tìm tổng số chim khi có thêm chim bay đến.",
          "mathematical_or_logical_goal": "Lựa chọn toán tử đại số (phép cộng)",
          "intermediate_output": "5 + 3"
        },
        {
          "step_number": 3,
          "instruction": "Thực hiện phép tính 5 + 3 và viết câu trả lời.",
          "mathematical_or_logical_goal": "Tính toán và kết luận kèm danh số",
          "intermediate_output": "8 con chim"
        }
      ],
      "final_answer": {
        "value": 8,
        "unit": "con chim",
        "normalized_display": "8 con chim",
        "acceptable_variants": [
          "8",
          "8 con",
          "8 con chim"
        ]
      },
      "adhd_scaffolding_notes": {
        "working_memory_pitfall": "Trẻ dễ bị xao nhãng bởi từ ngữ miêu tả 'cành cây', 'bay đến' và quên mất số lượng ban đầu.",
        "executive_function_scaffolding": "Tách từ khóa hành động 'thêm' để kích hoạt phép cộng đơn bước.",
        "visual_or_concrete_aid": "Biểu tượng 5 chấm tròn màu xanh + 3 chấm tròn màu đỏ trên màn hình."
      }
    },
    {
      "id": "G1_MATH_02",
      "grade": 1,
      "subject": "Toán",
      "category": "Toán lời văn",
      "topic": "Phép trừ trong phạm vi 20 không nhớ (Dạng toán bớt đi)",
      "difficulty": "Cơ bản (Nhận biết/Thông hiểu)",
      "estimated_duration_min": 5,
      "original_text": "Mẹ mua về 18 quả cam. Cả nhà đã ăn hết 6 quả cam. Hỏi mẹ còn lại bao nhiêu quả cam?",
      "options": null,
      "distractor_analysis": null,
      "ground_truth_steps": [
        {
          "step_number": 1,
          "instruction": "Đọc đề bài và xác định số quả cam lúc đầu mẹ có và số quả đã ăn.",
          "mathematical_or_logical_goal": "Trích xuất dữ kiện đầu vào",
          "intermediate_output": "Có: 18 quả; Đã ăn: 6 quả"
        },
        {
          "step_number": 2,
          "instruction": "Lấy số cam lúc đầu trừ đi số cam đã ăn để tìm số cam còn lại.",
          "mathematical_or_logical_goal": "Thiết lập phép trừ",
          "intermediate_output": "18 - 6"
        },
        {
          "step_number": 3,
          "instruction": "Tính kết quả hàng đơn vị (8 - 6 = 2), giữ nguyên hàng chục và viết đáp số.",
          "mathematical_or_logical_goal": "Tính toán số học 2 chữ số trừ 1 chữ số",
          "intermediate_output": "12 quả cam"
        }
      ],
      "final_answer": {
        "value": 12,
        "unit": "quả cam",
        "normalized_display": "12 quả cam",
        "acceptable_variants": [
          "12",
          "12 quả",
          "12 quả cam"
        ]
      },
      "adhd_scaffolding_notes": {
        "working_memory_pitfall": "Hay nhầm lẫn giữa phép tính cộng và trừ khi đọc lướt qua từ 'còn lại'.",
        "executive_function_scaffolding": "Khóa sự chú ý vào hành động 'đã ăn hết' mang ý nghĩa bớt đi.",
        "visual_or_concrete_aid": "Bảng cấu tạo số tách 18 thành 10 và 8; gạch bỏ 6 đơn vị từ 8."
      }
    },
    {
      "id": "G1_VIET_03",
      "grade": 1,
      "subject": "Tiếng Việt",
      "category": "Tiếng Việt / Đọc hiểu",
      "topic": "Đọc hiểu văn bản ngắn & Nhận diện nhân vật và hành động",
      "difficulty": "Cơ bản (Nhận biết/Thông hiểu)",
      "estimated_duration_min": 5,
      "original_text": "Đọc đoạn văn sau và trả lời câu hỏi: 'Buổi sáng sớm, chú gà trống cất tiếng gáy vang báo hiệu ngày mới. Mặt trời từ từ nhô lên đỏ rực. Bé Mai thức dậy, đánh răng, rửa mặt rồi vui vẻ cùng mẹ đi bộ đến trường tiểu học.'\nCâu hỏi: Ai là người cất tiếng gáy vang vào buổi sáng sớm?",
      "options": null,
      "distractor_analysis": null,
      "ground_truth_steps": [
        {
          "step_number": 1,
          "instruction": "Đọc câu hỏi và tìm cụm từ khóa 'cất tiếng gáy vang'.",
          "mathematical_or_logical_goal": "Định vị từ khóa mục tiêu",
          "intermediate_output": "Cụm từ khóa: 'cất tiếng gáy vang'"
        },
        {
          "step_number": 2,
          "instruction": "Dò tìm trong câu đầu tiên của đoạn văn để xem con vật hoặc nhân vật nào thực hiện hành động đó.",
          "mathematical_or_logical_goal": "Đối chiếu ngữ cảnh",
          "intermediate_output": "'chú gà trống cất tiếng gáy vang'"
        },
        {
          "step_number": 3,
          "instruction": "Ghi lại tên nhân vật cất tiếng gáy.",
          "mathematical_or_logical_goal": "Trích xuất câu trả lời trực tiếp",
          "intermediate_output": "chú gà trống"
        }
      ],
      "final_answer": {
        "value": "chú gà trống",
        "unit": null,
        "normalized_display": "chú gà trống",
        "acceptable_variants": [
          "chú gà trống",
          "gà trống",
          "Chú gà trống",
          "con gà trống"
        ]
      },
      "adhd_scaffolding_notes": {
        "working_memory_pitfall": "Trẻ bị thu hút bởi tên nhân vật người 'Bé Mai' ở câu cuối mà vội vã chọn Mai thay vì gà trống.",
        "executive_function_scaffolding": "Chỉ dẫn đọc dò từng dòng (Line-by-line reading mask).",
        "visual_or_concrete_aid": "Tô đậm màu vàng cụm từ 'cất tiếng gáy vang' trong câu 1."
      }
    },
    {
      "id": "G1_MCQ_04",
      "grade": 1,
      "subject": "Khoa học & Tự nhiên xã hội",
      "category": "Trắc nghiệm nhiều câu ABCD",
      "topic": "Nhận biết hình học phẳng và số lượng trong mô hình thực tế",
      "difficulty": "Cơ bản (Nhận biết/Thông hiểu)",
      "estimated_duration_min": 4,
      "original_text": "Hình vẽ một ngôi nhà gồm: một mái nhà hình tam giác, thân nhà hình chữ nhật, một cửa chính hình chữ nhật và hai cửa sổ hình tròn. Hỏi ngôi nhà đó có bao nhiêu hình tròn?\nA. 1 hình tròn\nB. 2 hình tròn\nC. 3 hình tròn\nD. 4 hình tròn",
      "options": {
        "A": "1 hình tròn",
        "B": "2 hình tròn",
        "C": "3 hình tròn",
        "D": "4 hình tròn"
      },
      "distractor_analysis": {
        "A": "Bẫy nhầm lẫn số lượng với 1 cửa chính hoặc 1 mái nhà.",
        "B": "Đáp án ĐÚNG (đề nêu rõ 'hai cửa sổ hình tròn').",
        "C": "Bẫy cộng gộp: 1 cửa chính + 2 cửa sổ = 3.",
        "D": "Bẫy đếm tổng toàn bộ 4 chi tiết của ngôi nhà."
      },
      "ground_truth_steps": [
        {
          "step_number": 1,
          "instruction": "Xác định câu hỏi yêu cầu đếm hình gì (hình tam giác, hình vuông hay hình tròn).",
          "mathematical_or_logical_goal": "Xác định hình tiêu điểm",
          "intermediate_output": "Hình tiêu điểm: hình tròn"
        },
        {
          "step_number": 2,
          "instruction": "Đọc lại mô tả và tìm từ 'hình tròn' kèm số lượng tương ứng.",
          "mathematical_or_logical_goal": "Quét văn bản tìm cặp (thuộc tính, số lượng)",
          "intermediate_output": "'hai cửa sổ hình tròn' -> 2"
        },
        {
          "step_number": 3,
          "instruction": "So khớp với các phương án A, B, C, D để chọn phương án chứa số 2.",
          "mathematical_or_logical_goal": "Khẳng định phương án đúng",
          "intermediate_output": "Phương án B"
        }
      ],
      "final_answer": {
        "value": "B",
        "unit": null,
        "normalized_display": "B. 2 hình tròn",
        "acceptable_variants": [
          "B",
          "B.",
          "2 hình tròn",
          "2",
          "B. 2 hình tròn"
        ]
      },
      "adhd_scaffolding_notes": {
        "working_memory_pitfall": "Xu hướng hấp tấp chọn số 1 vì nhìn thấy số 'một' xuất hiện đầu tiên trong đề bài.",
        "executive_function_scaffolding": "Buộc trẻ xác nhận tiêu chí lọc 'hình tròn' trước khi nhìn vào các đáp án A/B/C/D.",
        "visual_or_concrete_aid": "Hình ảnh trực quan khoanh tròn hai cửa sổ."
      }
    },
    {
      "id": "G1_ENG_05",
      "grade": 1,
      "subject": "Tiếng Anh",
      "category": "Tiếng Anh tiểu học",
      "topic": "Vocabulary: Colors & Everyday Objects",
      "difficulty": "Cơ bản (Nhận biết/Thông hiểu)",
      "estimated_duration_min": 4,
      "original_text": "Choose the correct word to complete the sentence:\n'Look at my new pencil. It is ______.' (Màu đỏ)\nA. blue\nB. green\nC. red\nD. yellow",
      "options": {
        "A": "blue",
        "B": "green",
        "C": "red",
        "D": "yellow"
      },
      "distractor_analysis": {
        "A": "blue = màu xanh da trời.",
        "B": "green = màu xanh lá cây.",
        "C": "Đáp án ĐÚNG (red = màu đỏ).",
        "D": "yellow = màu vàng."
      },
      "ground_truth_steps": [
        {
          "step_number": 1,
          "instruction": "Xác định từ khóa tiếng Việt trong ngoặc đơn chỉ màu sắc cần tìm: 'Màu đỏ'.",
          "mathematical_or_logical_goal": "Xác định nghĩa mục tiêu",
          "intermediate_output": "Nghĩa: Màu đỏ"
        },
        {
          "step_number": 2,
          "instruction": "Nhớ lại từ vựng tiếng Anh tương ứng với Màu đỏ.",
          "mathematical_or_logical_goal": "Truy xuất trí nhớ từ vựng L1 -> L2",
          "intermediate_output": "red"
        },
        {
          "step_number": 3,
          "instruction": "Dò tìm chữ 'red' trong 4 lựa chọn A, B, C, D.",